dept,party,name,votes
Atlántida,DC,Ana Maribel Valle Rivera,2335
Atlántida,DC,Gloria Maria Sarmiento Nu¿ez,5372
Atlántida,DC,Jorge Alberto Elvir Cruz,2846
Atlántida,DC,Jose Armando Logan ,4909
Atlántida,DC,Josue Eleazer Aleman Izcoa,835
Atlántida,DC,Kenia Fabiola Chiesa Elvir,2321
Atlántida,DC,Kennia Yamileth Montero Martinez,2005
Atlántida,DC,Ramon Antonio Varela Medina,2382
Atlántida,FAPER,Alicia De Jesus Alvarez Acosta,579
Atlántida,FAPER,Arlen Carolina Martinez Guzman,254
Atlántida,FAPER,Cristobal Crispi Oliva Mejia,1712
Atlántida,FAPER,Juana Concepcion Aguilar Avelar,372
Atlántida,FAPER,Marcio Renieri Castellanos ,359
Atlántida,FAPER,Norma Patricia Guevara Gamez,689
Atlántida,FAPER,Santos Aristeo Lainez Hernandez,446
Atlántida,FAPER,Vilma Yolanda Pineda Ramirez,331
Atlántida,LIBRE,Audelia  Rodriguez Rodriguez,23558
Atlántida,LIBRE,Belin Bekker Rosa Calix,22340
Atlántida,LIBRE,Cesar Humberto Agurcia Lopez,23510
Atlántida,LIBRE,Gloria Cristina Torres Sevilla,21896
Atlántida,LIBRE,Joaquin Baldemar Alvarado ,23066
Atlántida,LIBRE,Jose Adalid Rodriguez Rosa,20186
Atlántida,LIBRE,Jose Anibal Rodriguez Milla,22891
Atlántida,LIBRE,Jose Manuel Santos Villeda,21638
Atlántida,Liberal,Alba Ruth Zavala Irias,13123
Atlántida,Liberal,Christian Reniery Santamaria ,25108
Atlántida,Liberal,Dournoft Delmar Alvarado Mc Nab,15935
Atlántida,Liberal,Gonzalo Antonio Rivera ,16725
Atlántida,Liberal,Hector Pavel Fajardo Orellana,16769
Atlántida,Liberal,Iris Leticia Molinero Canales,15767
Atlántida,Liberal,Jerry Francisco Sabio Amaya,18455
Atlántida,Liberal,Maria Aracely Leiva Pe¿a,19297
Atlántida,Nacional,Carmen Esperanza Rivera Pagoaga,37208
Atlántida,Nacional,Daniel  Flores Velasquez,32090
Atlántida,Nacional,Francis Yolanda Castro Rodriguez,27150
Atlántida,Nacional,Iveth Obdulia Matute Betancourth,26185
Atlántida,Nacional,Marcio Rene Espinal Cardona,31128
Atlántida,Nacional,Marco Antonio Midence Milla,32142
Atlántida,Nacional,Ramon Antonio Leva Bulnes,33544
Atlántida,Nacional,Rodolfo  Irias Navas,37865
Atlántida,PAC,Carlos Arturo San Martin Amador,9264
Atlántida,PAC,Carlos Mauricio Arge¿al Castro,9181
Atlántida,PAC,Gabriela  Guzman Mejia,9150
Atlántida,PAC,Kritza Jerlin Perez Gallegos,12834
Atlántida,PAC,Marie Jeannette Kawas Giacoman,11524
Atlántida,PAC,Obdulio  Madrid Zeron,8993
Atlántida,PAC,Ruth  Bonilla Argueta,9063
Atlántida,PAC,Tomas Antonio Ramirez Hernandez,12156
Atlántida,PAP,Dagoberto  Cruz Santos,1035
Atlántida,PAP,Fermin  Corrales Estrada,298
Atlántida,PAP,Francisco Jose Alvarado Zaldivar,271
Atlántida,PAP,Mirian Elizabeth Villanueva Blanco,515
Atlántida,PAP,Mirtha Esther Hernandez Dolmo,934
Atlántida,PAP,Otilia Janin Carrasco Ponce,844
Atlántida,PAP,Sila Claritza Mena Burgos,495
Atlántida,PAP,Victor Daniel Escobar Pe¿a,312
Atlántida,PINU,Bernard  Martinez Valerio,4171
Atlántida,PINU,Elbin Antonio Orellana Bermudez,776
Atlántida,PINU,Gladys Lizzette Zapata Guerrero,1677
Atlántida,PINU,Guillermo  Escoto Rodriguez,1085
Atlántida,PINU,Lidia Zenaida Fernandez Garcia,863
Atlántida,PINU,Melida Juliana Quevedo Ramirez,1343
Atlántida,PINU,Warren  Lopez Flores,543
Atlántida,PINU,Yeimy Lizbeth Zaldivar Castellanos,744
Atlántida,UD,Aldo Javier Cardona Alvarado,1814
Atlántida,UD,Alix Virginia Zapata ,677
Atlántida,UD,Darwin Alexander Montoya Ayala,707
Atlántida,UD,Javier Arquimides Martinez Reyes,1772
Atlántida,UD,Maria  Alberto Hernandez,1894
Atlántida,UD,Noemi Yadira Casta¿eda Lopez,994
Atlántida,UD,Pedro  Guevara ,1492
Atlántida,UD,Ramon Nectaly Guardado ,1392
Choluteca,DC,Brenda Isolina Erazo Herrera,1004
Choluteca,DC,Elmer Noe Garcia Moran,1642
Choluteca,DC,Jorge Manuel Lazo ,908
Choluteca,DC,Jose Rafael Berrios Flores,723
Choluteca,DC,Lizbeth Alejandra Sosa Euceda,804
Choluteca,DC,Lourdes Rosmery Ferrufino Cuevas,1150
Choluteca,DC,Luis Alonso Marcia Hernandez,6283
Choluteca,DC,Oscar Arnulfo Cruz ,1533
Choluteca,DC,Rosa Elena Martinez ,478
Choluteca,FAPER,Carlos Fabricio Flores Baca,460
Choluteca,FAPER,Franklin Erick Toru¿o Colindres,593
Choluteca,FAPER,Julia Maritza Vasquez Ponce,153
Choluteca,FAPER,Karen Marleny Izaguirre ,194
Choluteca,FAPER,Luis Alberto Herrera ,472
Choluteca,FAPER,Maria Leonor Tercero Mendez,155
Choluteca,FAPER,Nancy Raquel Portillo Gomez,298
Choluteca,FAPER,Raquel  Montalvan ,217
Choluteca,FAPER,Ronald Adalberto Ruiz Vindel,557
Choluteca,LIBRE,Angel Enrique Sandoval Lopez,25472
Choluteca,LIBRE,Cristobal Jowany Rodriguez Amador,23267
Choluteca,LIBRE,Dilma Doris Ramirez ,20391
Choluteca,LIBRE,Francisco Javier Lazo Mercado,20362
Choluteca,LIBRE,Hector Enrrique Padilla Hernandez,24806
Choluteca,LIBRE,Hernan Abel Carrasco Mayorga,21431
Choluteca,LIBRE,Luis Geovany Martinez Sanchez,23217
Choluteca,LIBRE,Martha Lidia Armas ,19992
Choluteca,LIBRE,Mercedes  Baca Paz,18773
Choluteca,Liberal,Blanca Margarita Oyuela Carrasco,17209
Choluteca,Liberal,Carlos Alfredo Lara Watson,35005
Choluteca,Liberal,Felipe Nery Mendez Soriano,25312
Choluteca,Liberal,Fredy Omar Chavarria Castillo,24673
Choluteca,Liberal,Gary Ramon Maradiaga Soriano,26855
Choluteca,Liberal,Maria Bertilia Zepeda Lagos,21563
Choluteca,Liberal,Maria Estelita Canales Ordo¿ez,16054
Choluteca,Liberal,Oscar Alfredo Benavides Ordo¿ez,28953
Choluteca,Liberal,Yury Cristhian Sabas Gutierrez,55999
Choluteca,Nacional,Carlos Roberto Ledezma Casco,61830
Choluteca,Nacional,Francisco Antonio Macias Ortega,57363
Choluteca,Nacional,Fredy  Espinoza Mondragon,30311
Choluteca,Nacional,Juan Francisco Arge¿al Espinal,40407
Choluteca,Nacional,Juana Isabel Lainez Aguilar,28984
Choluteca,Nacional,Maria Emerita Bardales Hernandez,50350
Choluteca,Nacional,Mauricio  Oliva Herrera,60204
Choluteca,Nacional,Rodanin  Peralta Estrada,43734
Choluteca,Nacional,Vilma Guadalupe Aguilar Flores,38671
Choluteca,PAC,Belinda Patricia Marcia Bonilla,7194
Choluteca,PAC,Darmy Adelaida Estrada Villalobos,7881
Choluteca,PAC,David Armando Reyes Osorto,15526
Choluteca,PAC,Jorge Eliu Perez Dominguez,11940
Choluteca,PAC,Julio Cesar Farach Narvaez,4716
Choluteca,PAC,Karen Melissa Linarez Osorto,8703
Choluteca,PAC,Luis Fernando Coello ,12124
Choluteca,PAC,Ricardo Leonel Davila Vieras,5726
Choluteca,PAC,Trudis Aminda Corrales Osorto,4771
Choluteca,PAP,Blanca Lidia Garcia Lezama,193
Choluteca,PAP,Claudia Angelina Martinez Castillo,368
Choluteca,PAP,Felicita Maria Carranza Ordo¿ez,1061
Choluteca,PAP,Gonzalo Johel Romero Alvarez,280
Choluteca,PAP,Jose Ramon Sierra Zamora,1018
Choluteca,PAP,Karla Patricia Aguilar ,271
Choluteca,PAP,Mayra Karina Oyuela Estrada,236
Choluteca,PAP,Nelson Omar Funez Flores,1498
Choluteca,PAP,Oscar  Espinal Baquedano,282
Choluteca,PINU,Emerita  Anduray Fuentes,1066
Choluteca,PINU,Gerson Leonel Espino Maradiaga,1551
Choluteca,PINU,Gloria Azucena Martinez Guillen,1059
Choluteca,PINU,Gloria Esperanza Cruz Godoy,562
Choluteca,PINU,Herles Misael Gimenez Galo,1834
Choluteca,PINU,Jose Irecio Bonilla Bonilla,2125
Choluteca,PINU,Jose Mercedes Estrada Martinez,1200
Choluteca,PINU,Lydia De Jesus Herrera Aguirre,1178
Choluteca,PINU,Modesto  Herrera Sanchez,6219
Choluteca,UD,Benedicto  Carcamo Mejia,1545
Choluteca,UD,Dilcia Esmeralda Sandoval Auceda,609
Choluteca,UD,Felipe Nery Espinal Lopez,847
Choluteca,UD,Gerson  Hernandez Oviedo,2028
Choluteca,UD,Jose Francisco Ramirez Pineda,711
Choluteca,UD,Maria Clarett Velasquez ,326
Choluteca,UD,Nora Odalys Escobar Pover,254
Choluteca,UD,Rosibel  Zepeda Ochoa,1277
Choluteca,UD,Yelson Joel Ponce Ordo¿ez,672
Choluteca,Unidos Choluteca,Jose Cesar Ortega Souza,7494
Colón,DC,Doroteo  Ventura Santos,278
Colón,DC,Juana Oneyda Hernandez Castro,231
Colón,DC,Leonardo Damian Ramos Martin,259
Colón,DC,Maria Magdalena Bonilla Sanchez,483
Colón,FAPER,Daisy Suyapa Cruz Ramos,279
Colón,FAPER,Danis Oralia Rodriguez Sanchez,235
Colón,FAPER,Keila Lilibeth Cruz Garcia,427
Colón,FAPER,Luis Alonso Membre¿o Castillo,658
Colón,LIBRE,Adelmo Rubilio Ramos Rivera,28856
Colón,LIBRE,Tatiana Ninoska Canales Gonzales,28979
Colón,LIBRE,Wilfredo  Paz Zuniga,29641
Colón,LIBRE,Yoni  Rivas Baire,26591
Colón,Liberal,Alfredo David Ramos Castillo,10962
Colón,Liberal,Mayra Rosibel Pavon Umanzor,11296
Colón,Liberal,Midence Oquely Martinez Turcios,13479
Colón,Liberal,Samuel  Martinez Duron,11585
Colón,Nacional,Carlos Ramon Aguilar Guifarro,21622
Colón,Nacional,Ghisell  Padilla Pelayo,22194
Colón,Nacional,Oscar Ramon Najera ,24149
Colón,Nacional,Sonia Yamileth Garcia Vilorio,19884
Colón,PAC,Dania Valentina Mena Arzu,1659
Colón,PAC,Iris Yamileth Duarte Aleman,2312
Colón,PAC,Luis Adan Ochoa Matamoros,1597
Colón,PAC,Melvin Eriberto Velasquez Argueta,1621
Colón,PAP,Aura Yamileth Medina Gutierres,136
Colón,PAP,Idalia Judith Suazo Chimilio,137
Colón,PAP,Miquel Angel Garin Tejeda,234
Colón,PAP,Onasis Samir Serrano Ortiz,114
Colón,PINU,Domingo  Pineda Benitez,457
Colón,PINU,Erika Yamileth Galdamez Rojas,280
Colón,PINU,Karen Lizzeth Munguia ,234
Colón,PINU,Wilson Armando Sanchez Romero,425
Colón,UD,Adolfo  Casta¿eda Padilla,657
Colón,UD,Blanca Sulema Perez Sambula,285
Colón,UD,Coronado  Avila Munguia,574
Colón,UD,Glirian Yanira Bardales Garrido,241
Comayagua,DC,Ada Eliza Fernandez Morales,844
Comayagua,DC,Jorge Alberto Abrego ,1218
Comayagua,DC,Laura Marina Escoto Mejia,551
Comayagua,DC,Maria Evangelina Chaver Banegas,678
Comayagua,DC,Rene Alexander Ventura C,672
Comayagua,DC,Santos Humberto Hernandez Mejia,1344
Comayagua,DC,Tegualda Angela Gaete Santos,763
Comayagua,FAPER,Bernardino  Espinoza Palma,416
Comayagua,FAPER,Dimas  Rivera Discua,1423
Comayagua,FAPER,Ena Felicita Guillen Escobar,440
Comayagua,FAPER,Jose Dolores Urquia Lara,1903
Comayagua,FAPER,Maria Isnelda Mejia Cantor,201
Comayagua,FAPER,Tirso Sady Ulloa Ulloa,1493
Comayagua,FAPER,Yeny Yolanda Dominguez Aguilar,512
Comayagua,LIBRE,Ada Evila Serrano Nu¿ez,26523
Comayagua,LIBRE,Ancelmo  Romero Ulloa,26899
Comayagua,LIBRE,Fany Patricia Valladares Ortega,29391
Comayagua,LIBRE,Juan Carlos Avila Avila,24428
Comayagua,LIBRE,Juan Ramon Flores Buezo,28051
Comayagua,LIBRE,Salomon  Castillo Osorio,26755
Comayagua,LIBRE,Yavhe Salvador Sabillon Cruz,30637
Comayagua,Liberal,Gloria Argentina Bonilla Bonilla,33080
Comayagua,Liberal,Guillermo  Martinez Suazo,20784
Comayagua,Liberal,Jose Armando Cerros Chavez,22939
Comayagua,Liberal,Martha Lidya Rivera Torres,10810
Comayagua,Liberal,Olman Danery Maldonado Rubio,17411
Comayagua,Liberal,Valentin  Suarez Osejo,21550
Comayagua,Liberal,Victor Manuel Barahona ,21928
Comayagua,Nacional,Ana Belinda Valenzuela Duarte,34016
Comayagua,Nacional,Denis Roberto Velasquez Yanes,40582
Comayagua,Nacional,Gerardo Tulio Martinez Pineda,43562
Comayagua,Nacional,Jose Maria Martinez Valenzuela,49681
Comayagua,Nacional,Miguel Edgardo Martinez Pineda,45021
Comayagua,Nacional,Oscar Emilio Cruz Pineda,34444
Comayagua,Nacional,Santos  Discua Zepeda,33487
Comayagua,PAC,Alma Karina Mejia Sanchez,9207
Comayagua,PAC,Gerardo Javier Solorzano Leiva,10848
Comayagua,PAC,Jose Armando Calderon Ramirez,8876
Comayagua,PAC,Liliam Yaneth Villatoro Garcia,12542
Comayagua,PAC,Luciano Antonio Paz Arevalo,9875
Comayagua,PAC,Miguel Virgilio Ramirez Lopez,8805
Comayagua,PAC,Walterina  Ramirez Flores,8561
Comayagua,PAP,Diana Lourdes Lopez Sierra,3516
Comayagua,PAP,Francisco  Paz Osorio,508
Comayagua,PAP,Jose Alberto Melgar ,1486
Comayagua,PAP,Luther Celestino Hyde Zavala,1139
Comayagua,PAP,Mauricio  Bonilla Garcia,465
Comayagua,PAP,Miriam Hayde Valdivieso Argueta,1245
Comayagua,PAP,Nina Rosario Rodriguez Ramos,450
Comayagua,PINU,Alba Carixa Maradiaga Mejia,445
Comayagua,PINU,Antonia  Alvarado ,1414
Comayagua,PINU,Francisco Willian Caballero Paredes,1688
Comayagua,PINU,Geovani  Soto ,492
Comayagua,PINU,Karen Iveth Benitez Morales,816
Comayagua,PINU,Maria Zonia Pacheco Carranza,635
Comayagua,PINU,Mario Alexis Meza Duron,677
Comayagua,UD,Derling Ondina Alfaro Carranza,674
Comayagua,UD,Dunia Lorena Lopez Canales,705
Comayagua,UD,Gloria Julissa Rivera Padilla,634
Comayagua,UD,Martius Leonel Maga¿a Centeno,805
Comayagua,UD,Miguel Angel Galeano Mejia,1019
Comayagua,UD,Orlyn Daniel Flores Mejia,2914
Comayagua,UD,Saul Benjamin Zapata Mejia,3335
Copán,DC,Donis Marlen Caceres Mejia,220
Copán,DC,Dunia Lisseth Mata Chinchilla,368
Copán,DC,Eddas Mauricio Guevara Hernandez,230
Copán,DC,Ezequiel  Morales Tabora,1949
Copán,DC,Juan Antonio Perez Montufar,637
Copán,DC,Katherine Naszary Mejia ,261
Copán,DC,Nancy Francisca Casco Gomez,179
Copán,LIBRE,Edwin Dagoberto Lopez Lone,18468
Copán,LIBRE,Elvia Argentina Valle Villalta,26635
Copán,LIBRE,Gilma Janeth Trejo Bejarano,14194
Copán,LIBRE,Jose Omar Rodriguez Interiano,20230
Copán,LIBRE,Manuel De Jesus Mejia ,17667
Copán,LIBRE,Mario  Reyes ,14485
Copán,LIBRE,Scarleth Ivette Romero Cantarero,17011
Copán,Liberal,Elvis Edgardo Lemus Espa¿a,16891
Copán,Liberal,Jose Eduardo De Jesus Gauggel Medina,26961
Copán,Liberal,Juan Carlos Elvir Martel,24189
Copán,Liberal,Julio Cesar Santos Tobar,25547
Copán,Liberal,Lisandro Mauricio Arias Aquino,25871
Copán,Liberal,Oscar  Valenzuela Morales,14174
Copán,Liberal,Trancito Maribel Chinchilla Sorto,16052
Copán,Nacional,Carlos Roberto Guevara Velasquez,37362
Copán,Nacional,Hector Hugo Pinto Aguilar,43994
Copán,Nacional,Jorge Humberto Pinto Portillo,39689
Copán,Nacional,Jose Vicente Leon Rojas,46347
Copán,Nacional,Julio Cesar Gamez Interiano,36275
Copán,Nacional,Lourdes Ernestina Fajardo Ramos,37539
Copán,Nacional,Rosmery  Ayala Batres,38457
Copán,PAC,Agueda Maria Interiano Baide,1847
Copán,PAC,Carlos Antonio Alvarado Arita,1995
Copán,PAC,Cesar Daniel Bueso Orellana,3329
Copán,PAC,Francis Omar Cabrera Miranda,6336
Copán,PAC,Iris Lisseth Bueso Polanco,2050
Copán,PAC,Maryory Marivia Murillo Herrera,2775
Copán,PAC,Nelson Gerardo Tabora Zeron,2578
Copán,PINU,Claudia Maria Lopez Lara,245
Copán,PINU,Duvis Oneyda Bautista Claros,184
Copán,PINU,Fatima Ondina Lopez Garcia,152
Copán,PINU,Heydi Beatriz Perez Arita,199
Copán,PINU,Jose Francisco Tabora Dias,295
Copán,PINU,Maykol Ricarte Lopez Mejia,419
Copán,PINU,Miguel Angel Reyes Erazo,230
Copán,UD-FAPER,Digna Esperanza Mejia ,675
Copán,UD-FAPER,Hector Alexander Arita Martinez,1758
Copán,UD-FAPER,Jorge Armando Pleitez Palencia,2131
Copán,UD-FAPER,Leidy Iveth Gutierrez Cortes,469
Copán,UD-FAPER,Miguel Angel Lopez Contreras,1018
Copán,UD-FAPER,Miriam Vanessa Cruz Mu¿oz,361
Copán,UD-FAPER,Raul Antonio Madrid Argueta,745
Cortés,DC,Ana Leonor Velasquez Yonng,3264
Cortés,DC,Aquiles Isaac Calix Mejia,2748
Cortés,DC,Axel Antonio Quiroz Colindres,1797
Cortés,DC,Carlos Aguinaldo Turcios Matute,6413
Cortés,DC,Carlos Javier Funez Cardoza,2548
Cortés,DC,Celestino  Argueta ,4127
Cortés,DC,Dalia Suyapa Dubon Aleman,3391
Cortés,DC,Dunia Aracely Lopez Lopez,6028
Cortés,DC,Fredesvinda  Gutierrez Ortiz,4140
Cortés,DC,Irma Amelia Cerrato Martinez,3743
Cortés,DC,Jeanette Nohemy Guerra Guerra,1701
Cortés,DC,Jorge Adalberto Rodriguez Cardenas,3012
Cortés,DC,Jose Ricardo Sierra Chavarria,2541
Cortés,DC,Luis Antonio Flores Velasquez,1747
Cortés,DC,Luis Rafael Ramirez ,2528
Cortés,DC,Mario Alberto Soto Valle,2839
Cortés,DC,Norman  Portillo Velasquez,5500
Cortés,DC,Ruth Esther Castro Gomez,2776
Cortés,DC,Sadia Yarardin Argueta Hernandez,7404
Cortés,DC,Timoteo  Ochoa Diaz,3560
Cortés,FAPER,Alejandro  Rodriguez Bardales,1200
Cortés,FAPER,Alfonzo Felipe Rosado Galeano,1406
Cortés,FAPER,Aster Ascanio Alegria Castellanos,1941
Cortés,FAPER,Edith Xiomara Cruz Hernandez,971
Cortés,FAPER,Gary Alexander Rodriguez Villanueva,1328
Cortés,FAPER,Gloria Esmeralda Castro Serandia,1707
Cortés,FAPER,Irma Cristela Hernandez ,3349
Cortés,FAPER,Italo Marcelo Jephte Garay Barrientos,1008
Cortés,FAPER,Ivan Francisco Mejia Flores,1460
Cortés,FAPER,Jesus  Ortega Garcia,1441
Cortés,FAPER,Jony Nectali Rosales Ramos,2492
Cortés,FAPER,Josefina  Morales Pineda,1333
Cortés,FAPER,Kelvin Hernan Zaldivar Lopez,1131
Cortés,FAPER,Marco Antonio Bhaday Chavez,4699
Cortés,FAPER,Marlen Yaneth Paz Paz,1585
Cortés,FAPER,Marvin Emilio Funez Rodriguez,1206
Cortés,FAPER,Melvin Omar Bronfield Aguirre,1363
Cortés,FAPER,Osmara  Argueta Lozano,1379
Cortés,FAPER,Reyna Maritza Torres Mejia,2163
Cortés,FAPER,Sara  Ramirez Serrano,4999
Cortés,LIBRE,Ana Carolina Cartagena Gamero,74976
Cortés,LIBRE,Dulce Maria Villanueva Sanchez,76027
Cortés,LIBRE,Gladis Esmeralda Delcid Nieto,68354
Cortés,LIBRE,Jose Arnulfo Aguilar ,71751
Cortés,LIBRE,Jose Edgardo Castro Rodriguez,90625
Cortés,LIBRE,Jose Eduardo Coto Barnica,78581
Cortés,LIBRE,Jose Luis Cruz Rivera,82398
Cortés,LIBRE,Laura Elena Noriega Bardales,78359
Cortés,LIBRE,Luis Alonso Garcia Bustamante,70646
Cortés,LIBRE,Marco Tulio Del Arca ,73330
Cortés,LIBRE,Orfilia Esperanza Carranza Medina,75672
Cortés,LIBRE,Patricia Suyapa Murillo Gutierrez,72128
Cortés,LIBRE,Rene  Altamirano Interiano,69853
Cortés,LIBRE,Rene Bladimir Gonzales Alfaro,76442
Cortés,LIBRE,Reyna Concepcion Pineda Ramos,73984
Cortés,LIBRE,Ruy  Diaz Diaz,68457
Cortés,LIBRE,Scherly Melissa Arriaga Gomez,85445
Cortés,LIBRE,Silvia Bessy Ayala Figueroa,78112
Cortés,LIBRE,Victor Manuel Rosa Ramos,72440
Cortés,LIBRE,Yenny Yessenia Murillo Pe¿a,78679
Cortés,Liberal,Angel Dario Banegas Leiva,70125
Cortés,Liberal,Carlos Antonio Martinez Zepeda,55798
Cortés,Liberal,Carolina  Velasquez Matamoros,46635
Cortés,Liberal,Cinthya Pamela Menocal Turcios,41889
Cortés,Liberal,Felipa Elizabeth Avila Jimenez,50075
Cortés,Liberal,Georgina Yamileth Barahona Lopez,49870
Cortés,Liberal,Ingrid Alina Montes Rendon,40703
Cortés,Liberal,Jorge Antonio Camacho Fajardo,36104
Cortés,Liberal,Jose Antonio Barahona Zelaya,43636
Cortés,Liberal,Jose Antonio Fernandez Flores,41555
Cortés,Liberal,Juan Jorge Canahuati Sagastume,51793
Cortés,Liberal,Justa Aurelia Suazo Bernardez,41257
Cortés,Liberal,Maria Dolores Guardado ,46440
Cortés,Liberal,Marlon Guillermo Lara Orellana,79766
Cortés,Liberal,Miguel Angel Barahona Lopez,35438
Cortés,Liberal,Norma Haydee Calderon Arias,44650
Cortés,Liberal,Rafael Tadeo Nodarse Banegas,56689
Cortés,Liberal,Reyna Virginia Alvarado Barahona,44345
Cortés,Liberal,Ricardo Efrain Figueroa Giron,37269
Cortés,Liberal,Wenceslao  Lara Orellana,49656
Cortés,Nacional,Alberto  Chedrani Casta¿eda,92703
Cortés,Nacional,Arturo  Benda¿a Pinel,80674
Cortés,Nacional,Brenda Mercedes Flores Serrano,72681
Cortés,Nacional,Eliseo Noel Mejia Castillo,66169
Cortés,Nacional,Ernesto  Lazarus Pineda,65650
Cortés,Nacional,Francisco Gabriel Garcia Ardon,75321
Cortés,Nacional,Iris Yasmin Perdomo Sandoval,61794
Cortés,Nacional,Jose Antonio Montalvan Villafranca,70636
Cortés,Nacional,Leda Lizethe Garcia Pagan,76564
Cortés,Nacional,Leo Yamir Valentino Castellon Hirezi,75811
Cortés,Nacional,Max Alejandro Gonzales Sabillon,69300
Cortés,Nacional,Melvin  Ferraro Lainez,69991
Cortés,Nacional,Omahara  Hernandez Trujillo,69393
Cortés,Nacional,Reynaldo Geovanny Ekonomo Funes,74300
Cortés,Nacional,Roxana Geraldina Gonzalez Marmol,75047
Cortés,Nacional,Victoria  Carrasco Garcia,66938
Cortés,Nacional,Welsy Milena Vasquez Lopez,79023
Cortés,Nacional,Wendy Carolina Estevez Paredes,67296
Cortés,Nacional,Yaudet  Burbara Canahuati,76552
Cortés,Nacional,Zoila Wiladina Chiang Cortes,72007
Cortés,PAC,Anibal Javier Calix Funez,88326
Cortés,PAC,Carlos Donanim Montes Orellana,81066
Cortés,PAC,Catalina  Ponce Posas,74109
Cortés,PAC,Edy Mauricio Pe¿a Carias,83698
Cortés,PAC,Erasmo Antonio Sanabria Chinchilla,86869
Cortés,PAC,Fatima Patricia Mena Baide,101700
Cortés,PAC,Jaime Enrique Villegas Roura,103264
Cortés,PAC,Jose Medardo Caballero Moncada,78801
Cortés,PAC,Juan Ramon Lopez Bendeck,84995
Cortés,PAC,Katty Ester Sosa Garcia,88412
Cortés,PAC,Luis Rene Oliva Romero,89749
Cortés,PAC,Luis Rolando Redondo Guifarro,100297
Cortés,PAC,Margarita Zulema Hernandez Gomez,77625
Cortés,PAC,Maria Erlinda Enamorado Cerna,75668
Cortés,PAC,Roberto  Valenzuela Medina,85460
Cortés,PAC,Rolando Enrique Lopez ,85772
Cortés,PAC,Veronica  Torres Rivera,85182
Cortés,PAC,Veronica Isabel Trochez Sabillon,81037
Cortés,PAC,Walter Alex Banegas Aguilera,91474
Cortés,PAC,Yesica Carolina Mu¿oz Gonzales,83261
Cortés,PAP,Ana Eysabel Gomez ,1693
Cortés,PAP,Annuar Alfredo Suazo Kattan,1320
Cortés,PAP,Brenda Patricia Enamorado Alvarado,4576
Cortés,PAP,Cesar Augusto Hernandez Pe¿a,2429
Cortés,PAP,Digna Angelica Lara Espinoza,1143
Cortés,PAP,Eucebio  Acosta Zuniga,1637
Cortés,PAP,Felix Justo Freije Pe¿a,1767
Cortés,PAP,Gabriela Rosario Vasquez Aguilar,3337
Cortés,PAP,Gladys Patricia Enamorado Padilla,3230
Cortés,PAP,Gregoria  Ocampo Zuniga,1466
Cortés,PAP,Irwing Lindssay Guardado Veroy,2502
Cortés,PAP,Jesus  Enamorado Alvarado,3971
Cortés,PAP,Jordi Ricardo Monta¿ola Lopez,2893
Cortés,PAP,Jose Mario Berrios Serrano,4141
Cortés,PAP,Juan Constantino Marinakys Zelaya,2327
Cortés,PAP,Karen Dinora Ortega Osorto,2190
Cortés,PAP,Manuel Antonio Amaya ,1991
Cortés,PAP,Manuel De Jesus Licona Castro,1974
Cortés,PAP,Martin  Sanchez Gonzalez,1284
Cortés,PAP,Nanci Yadira Vasquez Garcia,1550
Cortés,PINU,Bertha Lydia Coello Hernandez,3115
Cortés,PINU,Elizabeth  Contreras ,3415
Cortés,PINU,Eugenio  Herrera Quiroz,1419
Cortés,PINU,Fernando  Mateo Garrigo,3719
Cortés,PINU,Francisco Rodolfo Jimenez Caballero,3797
Cortés,PINU,Gisela Maria Altamirano Sanchez,3274
Cortés,PINU,Jose Dionicio Ponce Palacios,2058
Cortés,PINU,Jose Toribio Aguilera Coello,12899
Cortés,PINU,Julio Ismael Rapalo Zepeda,1375
Cortés,PINU,Karla Patricia Herrera Ulloa,2796
Cortés,PINU,Luis Fernando Ramirez ,2278
Cortés,PINU,Martha Leticia Norales Arzu,4973
Cortés,PINU,Maura Aracely Funez Martinez,4491
Cortés,PINU,Melvin Geovany Florez Canales,2286
Cortés,PINU,Osman  Maldonado Ortiz,4928
Cortés,PINU,Pedro Rene Gonzalez Barahona,6464
Cortés,PINU,Sergio Rolando Brocato Martinez,1343
Cortés,PINU,Victorino  Carranza Ponce,2689
Cortés,PINU,Xiomara  Lizeth Pavon ,3153
Cortés,PINU,Zinia Yamilet Vargas Gallegos,2155
Cortés,UD,Alberto  Cruz Torres,4464
Cortés,UD,Alex Antonio Avila ,3650
Cortés,UD,Brenda Jaqueline Moreno Bardales,5756
Cortés,UD,Claudio Marcelo Villafranca Nu¿ez,6286
Cortés,UD,Damary Marlessy Mejia Amaya,4985
Cortés,UD,Danilo  Mejia Borjas,3950
Cortés,UD,Danilo Omar Isaula Vasquez,3856
Cortés,UD,Edwin Roberto Pavon Leon,20072
Cortés,UD,Emilia  Leiva Ayala,3966
Cortés,UD,Erika Tahina Avila Reyes,5269
Cortés,UD,Esequias  Doblado Hernandez,5321
Cortés,UD,Juan Francisco Gonzalez Portillo,3416
Cortés,UD,Juan Ramon De Jesus Vallecillo Gutierrez,3474
Cortés,UD,Maria Catalina Rivera Diaz,3364
Cortés,UD,Miguel Fernando Ruiz Rapalo,5848
Cortés,UD,Raul Edgardo Chinchilla Aguilar,5218
Cortés,UD,Romer Xavier Chavez Linarez,4908
Cortés,UD,Sonia Esperanza Bonilla Guevara,3924
Cortés,UD,Susana  Castillo Velasquez,8293
Cortés,UD,Yesenia Waleska Andino Lopez,4636
El Paraíso,DC,Ermis Yobanis Chavarria Lopez,194
El Paraíso,DC,Flerida Aida Valladares ,311
El Paraíso,DC,Jose David Moncada ,1051
El Paraíso,DC,Maria Jose Soliz Mercado,435
El Paraíso,DC,Naudia Maricela Borden Reyes,274
El Paraíso,DC,Oscar Emilio Carrasco Peralta,441
El Paraíso,FAPER,Arlett Del Carmen Acu¿a Sarantes,352
El Paraíso,FAPER,Claudia Yiseel Castellanos Rodriguez,162
El Paraíso,FAPER,Hector Nahun Martinez Sosa,237
El Paraíso,FAPER,Karla Patricia Sosa Fortin,167
El Paraíso,FAPER,Luis Arturo Salgado Centeno,144
El Paraíso,FAPER,Sindy Mariela Rodriguez Moncada,194
El Paraíso,LIBRE,Claudia Lorena Garmendia Garay,36005
El Paraíso,LIBRE,Daisy Guadalupe Rivera Ardon,32707
El Paraíso,LIBRE,Francisco Javier Paz Lainez,40111
El Paraíso,LIBRE,Jorge Arturo Zavala Flores,33737
El Paraíso,LIBRE,Luis Alberto Posadas Alfaro,32419
El Paraíso,LIBRE,Nehemias  Martinez Argueta,35964
El Paraíso,Liberal,Fredy Alberto Pastrana Molina,26319
El Paraíso,Liberal,King Lenard Varela Alvarez,26584
El Paraíso,Liberal,Luis Alberto Sanabria Caballero,23824
El Paraíso,Liberal,Mario Edgardo Segura Aroca,29495
El Paraíso,Liberal,Ramon  Chacon Ferrufino,31006
El Paraíso,Liberal,Rodrigo  Castillo Flores,29250
El Paraíso,Nacional,Cesar Humberto Cerrato Flores,42548
El Paraíso,Nacional,Hector Efrain Vallejo Cerna,42990
El Paraíso,Nacional,Jose Celin Discua Elvir,53630
El Paraíso,Nacional,Marisabel Del Carmen Ferrufino Flores,46812
El Paraíso,Nacional,Sara Ismela Medina Galo,50940
El Paraíso,Nacional,Walter Antonio Chavez Hernandez,55550
El Paraíso,PAC,Carlos Omar Oliva ,3949
El Paraíso,PAC,Claudia Emilia Avila Acu¿a,4177
El Paraíso,PAC,Merary Gissela Gonzalez Oseguera,3812
El Paraíso,PAC,Oscar Armando Alcantara Amador,4152
El Paraíso,PAC,Sally Xiomara Maradiaga Mendoza,3573
El Paraíso,PAC,Santos Arcelio Lagos ,4222
El Paraíso,PAP,Angel Amado Diaz Garcia,319
El Paraíso,PAP,Herenia  Bermudez Trejo,273
El Paraíso,PAP,Juan Angel Alvarez Gomez,1181
El Paraíso,PAP,Karla Ninoska Martinez Herrera,518
El Paraíso,PAP,Marvin Cesar Fonseca Martinez,548
El Paraíso,PAP,Wendy Yajaira Coto Zelaya,424
El Paraíso,PINU,Edy Alexis Murillo ,329
El Paraíso,PINU,Ena Karolina Pozo Ardon,525
El Paraíso,PINU,Jose Leon Aguilar ,1441
El Paraíso,PINU,Marlen Gricelda Fernandez Mendez,1236
El Paraíso,PINU,Olga Alicia Gamero Parria,560
El Paraíso,PINU,Oscar Emilio Menjivar Rubi,1231
El Paraíso,UD,Adolfo Enrique Garcia ,651
El Paraíso,UD,Consuelo Amparo Villalta Dominguez,367
El Paraíso,UD,Esmilda Marily Baquedano Rivas,276
El Paraíso,UD,Jacobo Adolfo Flores ,1714
El Paraíso,UD,Jose Hernan Figueroa Rodriguez,434
El Paraíso,UD,Lidesky Milenia Arge?al Martinez,547
Francisco Morazán,DC,Antonio  Amador Barrientos,2442
Francisco Morazán,DC,Augusto Domingo Cruz Asensio,44161
Francisco Morazán,DC,David Arturo Aguilera Vallejo,8401
Francisco Morazán,DC,Edgardo Alfonso Navarrete Melghem,5559
Francisco Morazán,DC,Eduardo Jorge Gaete Mejia,5424
Francisco Morazán,DC,Elsa  Vargas Gonzalez,4428
Francisco Morazán,DC,Estela Margarita Martinez Gonzales,4966
